{
  "object_type": "evaluation_result",
  "schema_version": "1.0.0",
  "evaluation_result_id": "01HZXYD9FQ8T7E6R5W4Q3P2N1M",
  "target_ref": "ai-response:01HZXYB30A3H8D1E3X6Y5J0P2R",
  "evaluator_id": "evaluator-qa",
  "score": 0.92,
  "score_range": { "min": 0, "max": 1 },
  "passed": true,
  "evaluated_at": "2025-01-15T12:20:00Z",
  "rubric": "response-quality-v1",
  "metrics": [
    { "metric": "groundedness", "value": 0.9 },
    { "metric": "clarity", "value": 0.95 }
  ],
  "notes": "Meets quality bar with minor factual uncertainty.",
  "created_at": "2025-01-15T12:20:00Z",
  "updated_at": "2025-01-15T12:20:00Z",
  "metadata": { "reviewer": "qa-team" }
}
